{"$schema":"https://json-schema.org/draft/2020-12/schema","$id":"https://universalos.dev/specs/build/lock-v1.json","title":"UniversalOS reproducible build lock v1","type":"object","additionalProperties":false,"required":["schema_version","build_id","source_revision","rust","yocto","target","inputs"],"properties":{"schema_version":{"const":1},"build_id":{"type":"string"},"source_revision":{"type":"string","minLength":7},"rust":{"type":"object","additionalProperties":false,"required":["version","sha256"],"properties":{"version":{"type":"string"},"sha256":{"type":"string","pattern":"^[a-f0-9]{64}$"}}},"yocto":{"type":"object","additionalProperties":false,"required":["revision","sha256"],"properties":{"revision":{"type":"string"},"sha256":{"type":"string","pattern":"^[a-f0-9]{64}$"}}},"target":{"type":"string"},"inputs":{"type":"array","minItems":1,"items":{"type":"object","additionalProperties":false,"required":["name","revision","sha256"],"properties":{"name":{"type":"string"},"revision":{"type":"string"},"sha256":{"type":"string","pattern":"^[a-f0-9]{64}$"}}}}}}
