{"schema_version":1,"build_id":"uos.build.reference-host-v1","source_revision":"deadbeef","rust":{"version":"unresolved-host-blocker","sha256":"aaaaaaaaaaaaaaaaaaaaaaaaaaaaaaaaaaaaaaaaaaaaaaaaaaaaaaaaaaaaaaaa"},"yocto":{"revision":"unresolved-host-blocker","sha256":"bbbbbbbbbbbbbbbbbbbbbbbbbbbbbbbbbbbbbbbbbbbbbbbbbbbbbbbbbbbbbbbb"},"target":"qemuarm64","inputs":[{"name":"universal-os","revision":"deadbeef","sha256":"cccccccccccccccccccccccccccccccccccccccccccccccccccccccccccccccc"}]}
